"ttl","ttl href"
"ЗАКОН ЗА ТЪРГОВСКИЯ РЕГИСТЪР И РЕГИСТЪРА НА ЮРИДИЧЕСКИТЕ ЛИЦА С НЕСТОПАНСКА ЦЕЛ (ЗАГЛ. ИЗМ. - ДВ, БР. 74 ОТ 2016 Г., В СИЛА ОТ 01.01.2018 Г.)","https://www.ciela.net/svobodna-zona-normativi/view/2135522741/zakon-za-targovskiya-registar-i-registara-na-yuridicheskite-litsa-s-nestopanska-tsel-(zagl-izm---dv-br-74-ot-2016-g-v-sila-ot-01012018-g)"
"ЗАКОН ЗА ОТГОВОРНОСТТА НА ДЪРЖАВАТА И ОБЩИНИТЕ ЗА ВРЕДИ (ЗАГЛ. ИЗМ. - ДВ, БР. 30 ОТ 11.04.2006 Г., В СИЛА ОТ 12.07.2006 Г.)","https://www.ciela.net/svobodna-zona-normativi/view/2131785730/zakon-za-otgovornostta-na-darzhavata-i-obshtinite-za-vredi-(zagl-izm---dv-br-30-ot-11042006-g-v-sila-ot-12072006-g)"
"ЗАКОН ЗА КОМИСИЯТА ЗА ФИНАНСОВ НАДЗОР","https://www.ciela.net/svobodna-zona-normativi/view/2135462849/zakon-za-komisiyata-za-finansov-nadzor"
"ЗАКОН ЗА СЪБРАНИЯТА, МИТИНГИТЕ И МАНИФЕСТАЦИИТЕ","https://www.ciela.net/svobodna-zona-normativi/view/2132284419/zakon-za-sabraniyata-mitingite-i-manifestatsiite"
"ЗАКОН ЗА УБЕЖИЩЕТО И БЕЖАНЦИТЕ","https://www.ciela.net/svobodna-zona-normativi/view/2135453184/zakon-za-ubezhishteto-i-bezhantsite"
"ЗАКОН ЗА ""ДЪРЖАВЕН ВЕСТНИК""","https://www.ciela.net/svobodna-zona-normativi/view/2133636096/zakon-za-"
"ЗАКОН ЗА АМНИСТИЯ ОТ 1989 Г.","https://www.ciela.net/svobodna-zona-normativi/view/2132064256/zakon-za-amnistiya-ot-1989-g"
"ЗАКОН ЗА ПЪТИЩАТА","https://www.ciela.net/svobodna-zona-normativi/view/2134914560/zakon-za-patishtata"
"ЗАКОН ЗА ОБЯВЯВАНЕ НА КОМУНИСТИЧЕСКИЯ РЕЖИМ В БЪЛГАРИЯ ЗА ПРЕСТЪПЕН","https://www.ciela.net/svobodna-zona-normativi/view/2134920192/zakon-za-obyavyavane-na-komunisticheskiya-rezhim-v-balgariya-za-prestapen"
"ЗАКОН ЗА МИТНИЦИТЕ","https://www.ciela.net/svobodna-zona-normativi/view/2134384640/zakon-za-mitnitsite"
"ЗАКОН ЗА ГАРАНТИРАНИТЕ ВЗЕМАНИЯ НА РАБОТНИЦИТЕ И СЛУЖИТЕЛИТЕ ПРИ НЕСЪСТОЯТЕЛНОСТ НА РАБОТОДАТЕЛЯ","https://www.ciela.net/svobodna-zona-normativi/view/2135484022/zakon-za-garantiranite-vzemaniya-na-rabotnitsite-i-sluzhitelite-pri-nesastoyatelnost-na-rabotodatelya"
"ЗАКОН ЗА РАДИОТО И ТЕЛЕВИЗИЯТА","https://www.ciela.net/svobodna-zona-normativi/view/2134447616/zakon-za-radioto-i-televiziyata"
"ЗАКОН ЗА ВЕТЕРАНИТЕ ОТ ВОЙНИТЕ НА РЕПУБЛИКА БЪЛГАРИЯ (ЗАГЛ. ДОП. - ДВ, БР. 105 ОТ 2016 Г.)","https://www.ciela.net/svobodna-zona-normativi/view/2134454784/zakon-za-veteranite-ot-voynite-na-republika-balgariya-(zagl-dop---dv-br-105-ot-2016-g)"
"ЗАКОН ЗА ЕЛЕКТРОННОТО УПРАВЛЕНИЕ","https://www.ciela.net/svobodna-zona-normativi/view/2135555445/zakon-za-elektronnoto-upravlenie"
"ЗАКОН ЗА МЕДИЦИНСКИТЕ ИЗДЕЛИЯ","https://www.ciela.net/svobodna-zona-normativi/view/2135555444/zakon-za-meditsinskite-izdeliya"
"ЗАКОН ЗА УРЕЖДАНЕ НА ЗАДЪЛЖЕНИЯ НА ""БУЛГАРГАЗ"" - ЕАД, КЪМ ДЪРЖАВАТА","https://www.ciela.net/svobodna-zona-normativi/view/2134682624/zakon-za-urezhdane-na-zadalzheniya-na-"
"ЗАКОН ЗА ИМУЩЕСТВОТО НА БЪЛГАРСКАТА КОМУНИСТИЧЕСКА ПАРТИЯ, БЪЛГАРСКИЯ ЗЕМЕДЕЛСКИ НАРОДЕН СЪЮЗ, ОТЕЧЕСТВЕНИЯ ФРОНТ, ДИМИТРОВСКИЯ КОМУНИСТИЧЕСКИ МЛАДЕЖКИ СЪЮЗ, СЪЮЗА НА АКТИВНИТЕ БОРЦИ ПРОТИВ ФАШИЗМА И КАПИТАЛИЗМА И БЪЛГАРСКИТЕ ПРОФЕСИОНАЛНИ СЪЮЗИ","https://www.ciela.net/svobodna-zona-normativi/view/2132595202/zakon-za-imushtestvoto-na-balgarskata-komunisticheska-partiya-balgarskiya-zemedelski-naroden-sayuz-otechestveniya-front-dimitrovskiya-komunisticheski-mladezhki-sayuz-sayuza-na-aktivnite-bortsi-protiv-fashizma-i-kapitalizma-i-balgarskite-profesionalni-sayuzi"
"ЗАКОН ЗА ВЪЗСТАНОВЯВАНЕ СОБСТВЕНОСТТА ВЪРХУ НЯКОИ МАГАЗИНИ, РАБОТИЛНИЦИ, СКЛАДОВЕ И АТЕЛИЕТА","https://www.ciela.net/svobodna-zona-normativi/view/2132595201/zakon-za-vazstanovyavane-sobstvenostta-varhu-nyakoi-magazini-rabotilnitsi-skladove-i-atelieta"
"ЗАКОН ЗА ПОЛИТИЧЕСКИТЕ ПАРТИИ","https://www.ciela.net/svobodna-zona-normativi/view/2135501352/zakon-za-politicheskite-partii"
"ЗАКОН ЗА АМНИСТИЯ ОТ 2002 Г.","https://www.ciela.net/svobodna-zona-normativi/view/2135456937/zakon-za-amnistiya-ot-2002-g"
"ЗАКОН ЗА СДРУЖЕНИЯ ЗА НАПОЯВАНЕ","https://www.ciela.net/svobodna-zona-normativi/view/2135180801/zakon-za-sdruzheniya-za-napoyavane"
"ЗАКОН ЗА ЕЛЕКТРОННИЯ ДОКУМЕНТ И ЕЛЕКТРОННИТЕ УДОСТОВЕРИТЕЛНИ УСЛУГИ (ЗАГЛ. ИЗМ. - ДВ, БР. 85 ОТ 2017 Г.)","https://www.ciela.net/svobodna-zona-normativi/view/2135180800/zakon-za-elektronniya-dokument-i-elektronnite-udostoveritelni-uslugi-(zagl-izm---dv-br-85-ot-2017-g)"
"ЗАКОН ЗА УРЕЖДАНЕ НА СТАРИ ЗАДЪЛЖЕНИЯ ПО БАНКОВИ КРЕДИТИ","https://www.ciela.net/svobodna-zona-normativi/view/2132552704/zakon-za-urezhdane-na-stari-zadalzheniya-po-bankovi-krediti"
"ЗАКОН ЗА ГЕОДЕЗИЯТА И КАРТОГРАФИЯТА","https://www.ciela.net/svobodna-zona-normativi/view/2135520647/zakon-za-geodeziyata-i-kartografiyata"
"ЗАКОН ЗА НОРМАТИВНИТЕ АКТОВЕ","https://www.ciela.net/svobodna-zona-normativi/view/2127837184/zakon-za-normativnite-aktove"
"ЗАКОН ЗА РЕГУЛИРАНЕ НА ВОДОСНАБДИТЕЛНИТЕ И КАНАЛИЗАЦИОННИТЕ УСЛУГИ","https://www.ciela.net/svobodna-zona-normativi/view/2135499390/zakon-za-regulirane-na-vodosnabditelnite-i-kanalizatsionnite-uslugi"
"ЗАКОН ЗА МЕСТНИТЕ ДАНЪЦИ И ТАКСИ","https://www.ciela.net/svobodna-zona-normativi/view/2134174720/zakon-za-mestnite-danatsi-i-taksi"
"ЗАКОН ЗА АМНИСТИЯ ОТ 1950 Г.","https://www.ciela.net/svobodna-zona-normativi/view/2121930240/zakon-za-amnistiya-ot-1950-g"
"ЗАКОН ЗА ТЕРИТОРИАЛНОТО ДЕЛЕНИЕ НА СТОЛИЧНАТА ОБЩИНА И ГОЛЕМИТЕ ГРАДОВЕ","https://www.ciela.net/svobodna-zona-normativi/view/2133624321/zakon-za-teritorialnoto-delenie-na-stolichnata-obshtina-i-golemite-gradove"
"ЗАКОН ЗА КОНСТИТУЦИОНЕН СЪД","https://www.ciela.net/svobodna-zona-normativi/view/2132575745/zakon-za-konstitutsionen-sad"
"ЗАКОН ЗА УРЕЖДАНЕ НА КОЛЕКТИВНИТЕ ТРУДОВИ СПОРОВЕ","https://www.ciela.net/svobodna-zona-normativi/view/2132290049/zakon-za-urezhdane-na-kolektivnite-trudovi-sporove"
"ЗАКОН ЗА СЧЕТОВОДСТВОТО ОТ 2001 Г.","https://www.ciela.net/svobodna-zona-normativi/view/2135213569/zakon-za-schetovodstvoto-ot-2001-g"
"ЗАКОН СРЕЩУ ПАЗАРНИТЕ ЗЛОУПОТРЕБИ С ФИНАНСОВИ ИНСТРУМЕНТИ","https://www.ciela.net/svobodna-zona-normativi/view/2135536081/zakon-sreshtu-pazarnite-zloupotrebi-s-finansovi-instrumenti"
"ЗАКОН ЗА ЗАЩИТА НА ЛИЦА, ЗАСТРАШЕНИ ВЪВ ВРЪЗКА С НАКАЗАТЕЛНО ПРОИЗВОДСТВО","https://www.ciela.net/svobodna-zona-normativi/view/2135495492/zakon-za-zashtita-na-litsa-zastrasheni-vav-vrazka-s-nakazatelno-proizvodstvo"
"ЗАКОН ЗА НАРОДНАТА ПРОСВЕТА ОТ 1991 Г.","https://www.ciela.net/svobodna-zona-normativi/view/2132585473/zakon-za-narodnata-prosveta-ot-1991-g"
"ЗАКОН ЗА ПЧЕЛАРСТВОТО","https://www.ciela.net/svobodna-zona-normativi/view/2135468444/zakon-za-pchelarstvoto"
"ЗАКОН ЗА ЗАКРИЛА НА ДЕТЕТО","https://www.ciela.net/svobodna-zona-normativi/view/2134925825/zakon-za-zakrila-na-deteto"
"ЗАКОН ЗА ЛЕКАРСТВЕНИТЕ ПРОДУКТИ В ХУМАННАТА МЕДИЦИНА","https://www.ciela.net/svobodna-zona-normativi/view/2135549536/zakon-za-lekarstvenite-produkti-v-humannata-meditsina"
"ЗАКОН ЗА ТОПОЛОГИЯТА НА ИНТЕГРАЛНИТЕ СХЕМИ","https://www.ciela.net/svobodna-zona-normativi/view/2134680578/zakon-za-topologiyata-na-integralnite-shemi"
"ЗАКОН ЗА МАРКИТЕ И ГЕОГРАФСКИТЕ ОЗНАЧЕНИЯ ОТ 1999 Г.","https://www.ciela.net/svobodna-zona-normativi/view/2134680576/zakon-za-markite-i-geografskite-oznacheniya-ot-1999-g"
"ЗАКОН ЗА ЗАКРИВАНЕ НА СОЦИАЛНОИНВЕСТИЦИОННИЯ ФОНД","https://www.ciela.net/svobodna-zona-normativi/view/2135668988/zakon-za-zakrivane-na-sotsialnoinvestitsionniya-fond"
"ЗАКОН ЗА ЖЕЛЕЗОПЪТНИЯ ТРАНСПОРТ","https://www.ciela.net/svobodna-zona-normativi/view/2134950912/zakon-za-zhelezopatniya-transport"
"ЗАКОН ЗА МЕДИАЦИЯТА","https://www.ciela.net/svobodna-zona-normativi/view/2135496713/zakon-za-mediatsiyata"
"ЗАКОН ЗА ИЗМЕРВАНИЯТА","https://www.ciela.net/svobodna-zona-normativi/view/2135449088/zakon-za-izmervaniyata"
"ЗАКОН ЗА БЮДЖЕТА НА НАЦИОНАЛНАТА ЗДРАВНООСИГУРИТЕЛНА КАСА ЗА 2011 Г.","https://www.ciela.net/svobodna-zona-normativi/view/2135708281/zakon-za-byudzheta-na-natsionalnata-zdravnoosiguritelna-kasa-za-2011-g"
"ЗАКОН ЗА АМНИСТИЯ И ВРЪЩАНЕ НА ОТНЕТИ ИМУЩЕСТВА","https://www.ciela.net/svobodna-zona-normativi/view/2132541953/zakon-za-amnistiya-i-vrashtane-na-otneti-imushtestva"
"ЗАКОН ЗА УСТАНОВЯВАНЕ НА ТРУДОВ И ОСИГУРИТЕЛЕН СТАЖ ПО СЪДЕБЕН РЕД","https://www.ciela.net/svobodna-zona-normativi/view/2135725118/zakon-za-ustanovyavane-na-trudov-i-osiguritelen-stazh-po-sadeben-red"
"ЗАКОН ЗА ЖИЛИЩНОСТРОИТЕЛНИТЕ КООПЕРАЦИИ","https://www.ciela.net/svobodna-zona-normativi/view/2129161729/zakon-za-zhilishtnostroitelnite-kooperatsii"
"ЗАКОН ЗА ЛЕЧЕБНИТЕ РАСТЕНИЯ","https://www.ciela.net/svobodna-zona-normativi/view/2134916096/zakon-za-lechebnite-rasteniya"
"ЗАКОН ЗА ЗАЩИТА ОТ ДИСКРИМИНАЦИЯ (ЗАГЛ. ИЗМ. - ДВ, БР. 68 ОТ 2006 Г.)","https://www.ciela.net/svobodna-zona-normativi/view/2135472223/zakon-za-zashtita-ot-diskriminatsiya-(zagl-izm---dv-br-68-ot-2006-g)"
"ЗАКОН ЗА ОГРАНИЧАВАНЕ НА АДМИНИСТРАТИВНОТО РЕГУЛИРАНЕ И АДМИНИСТРАТИВНИЯ КОНТРОЛ ВЪРХУ СТОПАНСКАТА ДЕЙНОСТ","https://www.ciela.net/svobodna-zona-normativi/view/2135468357/zakon-za-ogranichavane-na-administrativnoto-regulirane-i-administrativniya-kontrol-varhu-stopanskata-deynost"
"ЗАКОН ЗА ЛЕЧЕБНИТЕ ЗАВЕДЕНИЯ","https://www.ciela.net/svobodna-zona-normativi/view/2134670848/zakon-za-lechebnite-zavedeniya"
"ЗАКОН ЗА ЛОВА И ОПАЗВАНЕ НА ДИВЕЧА","https://www.ciela.net/svobodna-zona-normativi/view/2134941184/zakon-za-lova-i-opazvane-na-divecha"
"ЗАКОН ЗА УРЕЖДАНЕ ПРАВАТА НА ГРАЖДАНИ С МНОГОГОДИШНИ ЖИЛИЩНО-СПЕСТОВНИ ВЛОГОВЕ (ЗАГЛ. ИЗМ. - ДВ, БР. 100 ОТ 2008 Г., В СИЛА ОТ 21.11.2008 Г.)","https://www.ciela.net/svobodna-zona-normativi/view/2132583427/zakon-za-urezhdane-pravata-na-grazhdani-s-mnogogodishni-zhilishtno-spestovni-vlogove-(zagl-izm---dv-br-100-ot-2008-g-v-sila-ot-21112008-g)"
"ЗАКОН ЗА ПРЕДОТВРАТЯВАНЕ И УСТАНОВЯВАНЕ НА КОНФЛИКТ НА ИНТЕРЕСИ (ЗАГЛ. ИЗМ. - ДВ, БР. 97 ОТ 2010 Г., В СИЛА ОТ 10.12.2010 Г.) ОТ 2008 Г.","https://www.ciela.net/svobodna-zona-normativi/view/2135603507/zakon-za-predotvratyavane-i-ustanovyavane-na-konflikt-na-interesi-(zagl-izm---dv-br-97-ot-2010-g-v-sila-ot-10122010-g)-ot-2008-g"
"ЗАКОН ЗА ГОРИТЕ","https://www.ciela.net/svobodna-zona-normativi/view/2135721295/zakon-za-gorite"
"ЗАКОН ЗА ГЕНЕТИЧНО МОДИФИЦИРАНИ ОРГАНИЗМИ","https://www.ciela.net/svobodna-zona-normativi/view/2135501153/zakon-za-genetichno-modifitsirani-organizmi"
"ЗАКОН ЗА ВОЕННОИНВАЛИДИТЕ И ВОЕННОПОСТРАДАЛИТЕ","https://www.ciela.net/svobodna-zona-normativi/view/2135501152/zakon-za-voennoinvalidite-i-voennopostradalite"
"ЗАКОН ЗА ЗАЩИТА ОТ ДОМАШНОТО НАСИЛИЕ (ЗАГЛ. ИЗМ. - ДВ, БР. 102 ОТ 2009 Г., В СИЛА ОТ 22.12.2009 Г.)","https://www.ciela.net/svobodna-zona-normativi/view/2135501151/zakon-za-zashtita-ot-domashnoto-nasilie-(zagl-izm---dv-br-102-ot-2009-g-v-sila-ot-22122009-g)"
"ЗАКОН ЗА ВЪЗСТАНОВЯВАНЕ СОБСТВЕНОСТТА ВЪРХУ ОДЪРЖАВЕНИ НЕДВИЖИМИ ИМОТИ","https://www.ciela.net/svobodna-zona-normativi/view/2132811266/zakon-za-vazstanovyavane-sobstvenostta-varhu-odarzhaveni-nedvizhimi-imoti"
"ЗАКОН ЗА АМНИСТИЯ ОТ 1947 Г.","https://www.ciela.net/svobodna-zona-normativi/view/2121082368/zakon-za-amnistiya-ot-1947-g"
"ЗАКОН ЗА РЕГИСТЪР БУЛСТАТ","https://www.ciela.net/svobodna-zona-normativi/view/2135503074/zakon-za-registar-bulstat"
"ЗАКОН ЗА АКЦИЗИТЕ И ДАНЪЧНИТЕ СКЛАДОВЕ","https://www.ciela.net/svobodna-zona-normativi/view/2135512728/zakon-za-aktsizite-i-danachnite-skladove"
"ТЪРГОВСКИ ЗАКОН","https://www.ciela.net/svobodna-zona-normativi/view/-14917630/targovski-zakon"
"ЗАКОН ЗА ИНТЕГРАЦИЯ НА ХОРАТА С УВРЕЖДАНИЯ ОТ 2004 Г.","https://www.ciela.net/svobodna-zona-normativi/view/2135491478/zakon-za-integratsiya-na-horata-s-uvrezhdaniya-ot-2004-g"
"ЗАКОН ЗА ЕНЕРГИЙНАТА ЕФЕКТИВНОСТ ОТ 2008 Г.","https://www.ciela.net/svobodna-zona-normativi/view/2135605212/zakon-za-energiynata-efektivnost-ot-2008-g"
"ЗАКОН ЗА ВИСШЕТО ОБРАЗОВАНИЕ","https://www.ciela.net/svobodna-zona-normativi/view/2133647361/zakon-za-vissheto-obrazovanie"
"ЗАКОН ЗА ЗАЩИТА ОТ ВРЕДНОТО ВЪЗДЕЙСТВИЕ НА ХИМИЧНИТЕ ВЕЩЕСТВА И СМЕСИ (ЗАГЛ. ИЗМ. - ДВ, БР. 114 ОТ 2003 Г., В СИЛА ОТ 31.01.2004 Г., ИЗМ. - ДВ, БР. 63 ОТ 2010 Г., В СИЛА ОТ 13.08.2010 Г.)","https://www.ciela.net/svobodna-zona-normativi/view/2134906371/zakon-za-zashtita-ot-vrednoto-vazdeystvie-na-himichnite-veshtestva-i-smesi-(zagl-izm---dv-br-114-ot-2003-g-v-sila-ot-31012004-g-izm---dv-br-63-ot-2010-g-v-sila-ot-13082010-g)"
"ЗАКОН ЗА ЕКСПОРТНИЯ КОНТРОЛ НА ПРОДУКТИ, СВЪРЗАНИ С ОТБРАНАТА, И НА ИЗДЕЛИЯ И ТЕХНОЛОГИИ С ДВОЙНА УПОТРЕБА","https://www.ciela.net/svobodna-zona-normativi/view/2135725113/zakon-za-eksportniya-kontrol-na-produkti-svarzani-s-otbranata-i-na-izdeliya-i-tehnologii-s-dvoyna-upotreba"
"ЗАКОН ЗА КОНСУЛТАТИВЕН СЪВЕТ ЗА НАЦИОНАЛНА СИГУРНОСТ","https://www.ciela.net/svobodna-zona-normativi/view/2133334529/zakon-za-konsultativen-savet-za-natsionalna-sigurnost"
"ЗАКОН ЗА ЗАДЪЛЖИТЕЛНОТО ДЕПОЗИРАНЕ НА ПЕЧАТНИ И ДРУГИ ПРОИЗВЕДЕНИЯ И ЗА ОБЯВЯВАНЕ НА РАЗПРОСТРАНИТЕЛИТЕ И ДОСТАВЧИЦИТЕ НА МЕДИЙНИ УСЛУГИ (ЗАГЛ. ИЗМ. - ДВ, БР. 42 ОТ 2009 Г., В СИЛА ОТ 06.07.2009 Г., ДОП. - ДВ, БР. 94 ОТ 2018 Г.)","https://www.ciela.net/svobodna-zona-normativi/view/2134956545/zakon-za-zadalzhitelnoto-depozirane-na-pechatni-i-drugi-proizvedeniya-i-za-obyavyavane-na-razprostranitelite-i-dostavchitsite-na-mediyni-uslugi-(zagl-izm---dv-br-42-ot-2009-g-v-sila-ot-06072009-g-dop---dv-br-94-ot-2018-g)"
"ЗАКОН ЗА ТЪЛКУВАНЕ НА ЧЛ. 47 ОТ ЗАКОНА ЗА ЧУЖДЕНЦИТЕ В РЕПУБЛИКА БЪЛГАРИЯ (ДВ, БР. 153 ОТ 1998 Г.)","https://www.ciela.net/svobodna-zona-normativi/view/2134956544/zakon-za-talkuvane-na-chl-47-ot-zakona-za-chuzhdentsite-v-republika-balgariya-(dv-br-153-ot-1998-g)"
"ЗАКОН ЗА ОРДЕНИТЕ И МЕДАЛИТЕ НА РЕПУБЛИКА БЪЛГАРИЯ","https://www.ciela.net/svobodna-zona-normativi/view/2135468258/zakon-za-ordenite-i-medalite-na-republika-balgariya"
"ЗАКОН ЗА ДОГОВОРИТЕ ЗА ФИНАНСОВО ОБЕЗПЕЧЕНИЕ И ЗА ПРИКЛЮЧВАЩОТО НЕТИРАНЕ (ЗАГЛ. ДОП. - ДВ, БР. 67 ОТ 2025 Г.)","https://www.ciela.net/svobodna-zona-normativi/view/2135533910/zakon-za-dogovorite-za-finansovo-obezpechenie-i-za-priklyuchvashtoto-netirane-(zagl-dop---dv-br-67-ot-2025-g)"
"ЗАКОН ЗА ИНФОРМИРАНЕ И КОНСУЛТИРАНЕ С РАБОТНИЦИТЕ И СЛУЖИТЕЛИТЕ В МНОГОНАЦИОНАЛНИ ПРЕДПРИЯТИЯ, ГРУПИ ПРЕДПРИЯТИЯ И ЕВРОПЕЙСКИ ДРУЖЕСТВА","https://www.ciela.net/svobodna-zona-normativi/view/2135531976/zakon-za-informirane-i-konsultirane-s-rabotnitsite-i-sluzhitelite-v-mnogonatsionalni-predpriyatiya-grupi-predpriyatiya-i-evropeyski-druzhestva"
"ЗАКОН ЗА РИБАРСТВОТО И АКВАКУЛТУРИТЕ","https://www.ciela.net/svobodna-zona-normativi/view/2135184393/zakon-za-ribarstvoto-i-akvakulturite"
"ЗАКОН ЗА ОРЪЖИЯТА, БОЕПРИПАСИТЕ, ВЗРИВНИТЕ ВЕЩЕСТВА И ПИРОТЕХНИЧЕСКИТЕ ИЗДЕЛИЯ","https://www.ciela.net/svobodna-zona-normativi/view/2135696097/zakon-za-orazhiyata-boepripasite-vzrivnite-veshtestva-i-pirotehnicheskite-izdeliya"
"ЗАКОН ЗА АМНИСТИЯ ОТ 1964 Г.","https://www.ciela.net/svobodna-zona-normativi/view/2125500416/zakon-za-amnistiya-ot-1964-g"
"ЗАКОН ЗА ЗАКРИВАНЕ НА АГЕНЦИЯТА ЗА ЧУЖДЕСТРАННА ПОМОЩ","https://www.ciela.net/svobodna-zona-normativi/view/2135553197/zakon-za-zakrivane-na-agentsiyata-za-chuzhdestranna-pomosht"
"ЗАКОН ЗА ЧАСТНАТА ОХРАНИТЕЛНА ДЕЙНОСТ ОТ 2004 Г.","https://www.ciela.net/svobodna-zona-normativi/view/2135479817/zakon-za-chastnata-ohranitelna-deynost-ot-2004-g"
"ЗАКОН ЗА УРЕЖДАНЕ ПРАВАТА НА ЛИЦАТА, КОИТО СА ЗАЕЛИ ИЛИ ПОЛУЧИЛИ ДЪРЖАВНИ ДВОРНИ МЕСТА","https://www.ciela.net/svobodna-zona-normativi/view/2123412992/zakon-za-urezhdane-pravata-na-litsata-koito-sa-zaeli-ili-poluchili-darzhavni-dvorni-mesta"
"ЗАКОН ЗА ЕЛЕКТРОННИТЕ СЪОБЩЕНИЯ","https://www.ciela.net/svobodna-zona-normativi/view/2135553187/zakon-za-elektronnite-saobshteniya"
"ЗАКОН ЗА УРЕЖДАНЕ НА НЕОБСЛУЖВАНИТЕ КРЕДИТИ, ДОГОВОРЕНИ ДО 31 ДЕКЕМВРИ 1990 Г.","https://www.ciela.net/svobodna-zona-normativi/view/2133122051/zakon-za-urezhdane-na-neobsluzhvanite-krediti-dogovoreni-do-31-dekemvri-1990-g"
"ЗАКОН ЗА ЗДРАВОСЛОВНИ И БЕЗОПАСНИ УСЛОВИЯ НА ТРУД","https://www.ciela.net/svobodna-zona-normativi/view/2134178305/zakon-za-zdravoslovni-i-bezopasni-usloviya-na-trud"
"ЗАКОН ЗА ОТТЕГЛЯНЕ НА ДЕКЛАРАЦИИ ПО МЕЖДУНАРОДНАТА КОНВЕНЦИЯ ОТНОСНО НАМЕСАТА В ОТКРИТО МОРЕ В СЛУЧАИ НА БЕДСТВИЯ, ВОДЕЩИ ДО ЗАМЪРСЯВАНЕ НА МОРЕТО С НЕФТ, ОТ 1969 Г. И ЗА РАТИФИЦИРАНЕ НА ПРОТОКОЛА ОТНОСНО НАМЕСАТА В ОТКРИТО МОРЕ В СЛУЧАИ НА ЗАМЪРСЯВА","https://www.ciela.net/svobodna-zona-normativi/view/2135535792/zakon-za-otteglyane-na-deklaratsii-po-mezhdunarodnata-konventsiya-otnosno-namesata-v-otkrito-more-v-sluchai-na-bedstviya-vodeshti-do-zamarsyavane-na-moreto-s-neft-ot-1969-g-i-za-ratifitsirane-na-protokola-otnosno-namesata-v-otkrito-more-v-sluchai-na-zamarsyava"
"ЗАКОН ЗА ПАТЕНТИТЕ И РЕГИСТРАЦИЯТА НА ПОЛЕЗНИТЕ МОДЕЛИ (ЗАГЛ. ИЗМ. - ДВ, БР. 64 ОТ 2006 Г., В СИЛА ОТ 09.11.2006 Г.)","https://www.ciela.net/svobodna-zona-normativi/view/2133079553/zakon-za-patentite-i-registratsiyata-na-poleznite-modeli-(zagl-izm---dv-br-64-ot-2006-g-v-sila-ot-09112006-g)"
"ЗАКОН ЗА ИЗБИРАНЕ НА ВЕЛИКО НАРОДНО СЪБРАНИЕ","https://www.ciela.net/svobodna-zona-normativi/view/2132293633/zakon-za-izbirane-na-veliko-narodno-sabranie"
"ЗАКОН ЗА ДОСТЪП ДО ПРОСТРАНСТВЕНИ ДАННИ","https://www.ciela.net/svobodna-zona-normativi/view/2135667082/zakon-za-dostap-do-prostranstveni-danni"
"ЗАКОН ЗА ЕНЕРГИЯТА ОТ ВЪЗОБНОВЯЕМИ ИЗТОЧНИЦИ","https://www.ciela.net/svobodna-zona-normativi/view/2135728864/zakon-za-energiyata-ot-vazobnovyaemi-iztochnitsi"
"ЗАКОН ЗА ВЛИЗАНЕТО, ПРЕБИВАВАНЕТО И НАПУСКАНЕТО НА РЕПУБЛИКА БЪЛГАРИЯ НА ГРАЖДАНИТЕ НА ЕВРОПЕЙСКИЯ СЪЮЗ И ЧЛЕНОВЕТЕ НА ТЕХНИТЕ СЕМЕЙСТВА (ЗАГЛ. ДОП. - ДВ, БР. 97 ОТ 2016 Г., ИЗМ. - ДВ, БР. 34 ОТ 2019 Г.)","https://www.ciela.net/svobodna-zona-normativi/view/2135535758/zakon-za-vlizaneto-prebivavaneto-i-napuskaneto-na-republika-balgariya-na-grazhdanite-na-evropeyskiya-sayuz-i-chlenovete-na-tehnite-semeystva-(zagl-dop---dv-br-97-ot-2016-g-izm---dv-br-34-ot-2019-g)"
"ЗАКОН ЗА ДОСТЪП ДО ОБЩЕСТВЕНА ИНФОРМАЦИЯ","https://www.ciela.net/svobodna-zona-normativi/view/2134929408/zakon-za-dostap-do-obshtestvena-informatsiya"
"ЗАКОН ЗА АДМИНИСТРАТИВНИТЕ НАРУШЕНИЯ И НАКАЗАНИЯ","https://www.ciela.net/svobodna-zona-normativi/view/2126821377/zakon-za-administrativnite-narusheniya-i-nakazaniya"
"ЗАКОН ЗА ВЕРОИЗПОВЕДАНИЯТА","https://www.ciela.net/svobodna-zona-normativi/view/2135462355/zakon-za-veroizpovedaniyata"
"ЗАКОН ЗА СВРЪХЗАПАСИТЕ ОТ ЗЕМЕДЕЛСКИ И ЗАХАРНИ ПРОДУКТИ","https://www.ciela.net/svobodna-zona-normativi/view/2135537657/zakon-za-svrahzapasite-ot-zemedelski-i-zaharni-produkti"
"ЗАКОН ЗА ПАЗАРИТЕ НА ФИНАНСОВИ ИНСТРУМЕНТИ ОТ 2007 Г.","https://www.ciela.net/svobodna-zona-normativi/view/2135556966/zakon-za-pazarite-na-finansovi-instrumenti-ot-2007-g"
"ЗАКОН ЗА УРЕЖДАНЕ НА НЯКОИ ТРУДОВИ И ОСИГУРИТЕЛНИ ПРАВА НА БЪЛГАРСКИ ГРАЖДАНИ","https://www.ciela.net/svobodna-zona-normativi/view/2135605219/zakon-za-urezhdane-na-nyakoi-trudovi-i-osiguritelni-prava-na-balgarski-grazhdani"
"ЗАКОН ЗА НЕЗАВИСИМИТЕ ОЦЕНИТЕЛИ","https://www.ciela.net/svobodna-zona-normativi/view/2135605218/zakon-za-nezavisimite-otseniteli"
"ЗАКОН ЗА ПРИЕМАНЕ НА ДЕКЛАРАЦИЯ ЗА ПРИЗНАВАНЕ ЗАДЪЛЖИТЕЛНАТА ЮРИСДИКЦИЯ НА МЕЖДУНАРОДНИЯ СЪД И ЗА ОТТЕГЛЯНЕ НА РЕЗЕРВИТЕ ПО РАЗПОРЕДБИТЕ НА НЯКОИ МЕЖДУНАРОДНИ КОНВЕНЦИИ, ПРЕДВИЖДАЩИ ТАКАВА ЮРИСДИКЦИЯ","https://www.ciela.net/svobodna-zona-normativi/view/2132824577/zakon-za-priemane-na-deklaratsiya-za-priznavane-zadalzhitelnata-yurisdiktsiya-na-mezhdunarodniya-sad-i-za-otteglyane-na-rezervite-po-razporedbite-na-nyakoi-mezhdunarodni-konventsii-predvizhdashti-takava-yurisdiktsiya"
"ЗАКОН ЗА ОФИЦЕРСКИТЕ СЪБРАНИЯ","https://www.ciela.net/svobodna-zona-normativi/view/2135649625/zakon-za-ofitserskite-sabraniya"
"ЗАКОН ЗА ДЪРЖАВНИЯ ФОНД ЗА ГАРАНТИРАНЕ УСТОЙЧИВОСТ НА ДЪРЖАВНАТА ПЕНСИОННА СИСТЕМА","https://www.ciela.net/svobodna-zona-normativi/view/2135605211/zakon-za-darzhavniya-fond-za-garantirane-ustoychivost-na-darzhavnata-pensionna-sistema"
"ЗАКОН ЗА ОТТЕГЛЯНЕ НА РЕЗЕРВА И ПРИЕМАНЕ НА ДЕКЛАРАЦИЯ ПО МЕЖДУНАРОДНИ КОНВЕНЦИИ","https://www.ciela.net/svobodna-zona-normativi/view/2135728792/zakon-za-otteglyane-na-rezerva-i-priemane-na-deklaratsiya-po-mezhdunarodni-konventsii"
"ЗАКОН ЗА БЪЛГАРСКОТО ГРАЖДАНСТВО","https://www.ciela.net/svobodna-zona-normativi/view/2134446592/zakon-za-balgarskoto-grazhdanstvo"
"ЗАКОН ЗА ДВИЖЕНИЕТО ПО ПЪТИЩАТА","https://www.ciela.net/svobodna-zona-normativi/view/2134649345/zakon-za-dvizhenieto-po-patishtata"
"ЗАКОН ЗА МИНИСТЕРСТВОТО НА ВЪТРЕШНИТЕ РАБОТИ","https://www.ciela.net/svobodna-zona-normativi/view/2135516991/zakon-za-ministerstvoto-na-vatreshnite-raboti"
"ЗАКОН ЗА НЕЗАВИСИМИЯ ФИНАНСОВ ОДИТ ОТ 2001 Г.","https://www.ciela.net/svobodna-zona-normativi/view/2135215104/zakon-za-nezavisimiya-finansov-odit-ot-2001-g"
